{
  "portalId": "hr-test-portal",
  "name": "HR Test Portal",
  "description": "Test configuration for HR Portal",
  "branding": {
    "logoUrl": "/images/hr-logo.png",
    "primaryColor": "#d31820",
    "customCSS": ""
  },
  "layout": {
    "type": "grid",
    "columns": 12,
    "gap": "1rem",
    "responsive": {
      "sm": { "columns": 4 },
      "md": { "columns": 8 },
      "lg": { "columns": 12 }
    }
  },
  "components": [
    {
      "instanceId": "header-1",
      "componentId": "header",
      "position": { "row": 0, "column": 0, "span": 12 },
      "configuration": {
        "title": "HR Portal",
        "showLogo": true
      },
      "enabled": true,
      "sortOrder": 0
    },
    {
      "instanceId": "form-selector-1",
      "componentId": "form-selector",
      "position": { "row": 1, "column": 0, "span": 12 },
      "configuration": {
        "title": "Select a Form",
        "description": "Choose the appropriate HR form for your request"
      },
      "enabled": true,
      "sortOrder": 1
    }
  ],
  "permissions": {
    "allowedGroups": ["jira-users", "hr-team"],
    "adminGroups": ["hr-admins"],
    "publicAccess": false
  },
  "jiraIntegration": {
    "serviceDeskId": "HR_DESK",
    "defaultRequestTypeId": "GENERAL_REQUEST",
    "fieldMappings": {
      "employeeName": "customfield_10001",
      "effectiveDate": "customfield_10002",
      "department": "customfield_10003"
    },
    "workflowConfig": {
      "enableAutoAssignment": true,
      "defaultAssignee": "hr-team"
    },
    "enableAutoAssignment": true,
    "assignmentRules": [
      {
        "condition": { "department": "IT" },
        "assignee": "it-support"
      }
    ]
  }
}
